{
  "$schema": "../schemas/bosses.schema.json",
  "id": "bastion",
  "name": "Dame Bastion — The Wall of the Bay",
  "world": "w6",
  "kind": "boss",
  "hp": 14,
  "phases": 2,
  "traits": { "aggression": 0.2, "caution": 0.9, "trickery": 0.25, "patience": 0.9, "showmanship": 0.35 },
  "moveset": "sword_and_board",
  "abilities": [
    { "id": "rampart", "trigger": { "type": "onDistanceHeld", "range": "far", "seconds": 6 }, "effect": "barricade", "counter": "stomp_untriangulated_strut", "repeat": true }
  ],
  "gimmick": { "weakness": "hasty barricades lack diagonal bracing — stomp the un-triangulated strut" },
  "voicePack": "boss_bastion",
  "arena": "w6_arena_boss",
  "fossil": "w6-f6"
}
